{
    "ignoredExceptions": [],
    "informationalExceptions": {
        "System.NotImplementedException": "Propagation",
        "System.IO.IOException": "Propagation",
        "System.TimeoutException": "Always"
    },
    "disableXmlDocInterop": false,
    "disableLinqSupport": false,
    "disableLinqImplicitlyDeclaredExceptions": false,
    "disableControlFlowAnalysis": false,
    "enableLegacyRedundancyChecks": false,
    "treatThrowsExceptionAsCatchRest": false,
    "disableBaseExceptionDeclaredDiagnostic": false,
    "disableBaseExceptionThrownDiagnostic": false
}